,question,answer,contexts,faithfulness,answer_relevancy,context_relevancy
0,Quelle est le but de définir certain termes dans les GCP?,Le but de définir certains termes dans les CGP est d'éviter toute ambigüité entre les parties quant à leur signification exacte. Ces définitions s'imposent donc aux parties.,"['Agilitaton – Conditons générales de partenariat \n\n1.Définitons de certains termes applicables aux CGP \n\na.Dans les CGP, certains termes font l’objet d’une définition prévue dans cet article afin d’éviter toute ambigüité entre les parties quant à leur signification exacte. \nb.Ces définitions s’imposent donc aux Parties.']",1.0,0.9385770436469906,0.25
1,l'annexe peut-elle être séparée des GCP?,"Non, l'annexe ne peut pas être séparée des CGP car elle s'intègre aux CGP et constitue un tout indissociable avec lui.",[' \n- Annexe(s) : désigne le(s) document(s) que les parties rédigent séparément et joignent au contrat. L’annexe s’intègre aux CGP et constitue un tout indissociable avec lui.'],0.5,0.0,0.5
2,Par quel terem générique est désigné le GCP?,The document provided does not provide information on what the generic term for GCP is.,"['Agilitaton – Conditons générales de partenariat \n\n1.Définitons de certains termes applicables aux CGP \n\na.Dans les CGP, certains termes font l’objet d’une définition prévue dans cet article afin d’éviter toute ambigüité entre les parties quant à leur signification exacte. \nb.Ces définitions s’imposent donc aux Parties.']",,0.0,0.25
3,Quelle est la signification de RGPD?,"La signification de RGPD est ""Règlement Général sur la Protection des Données"". Il s'agit d'un règlement européen (Règlement (UE) 2016/679) qui vise à protéger les données à caractère personnel.",[' \n- RGPD : ou « règlement général sur la protection des données » Règlement (UE) 2016/679 du Parlement Européen et du Conseil du 27 avril 2016 : il s’agit du règlement européen protégeant les données à caractère personnelles Supports : partenaires commerciaux supports de diffusion des campagnes de marketing mises en place par Agilitation \n\n2.'],1.0,0.9505204207276888,1.0
4,De quand date le RGPD?,Le RGPD date du 27 avril 2016.,[' \n- RGPD : ou « règlement général sur la protection des données » Règlement (UE) 2016/679 du Parlement Européen et du Conseil du 27 avril 2016 : il s’agit du règlement européen protégeant les données à caractère personnelles Supports : partenaires commerciaux supports de diffusion des campagnes de marketing mises en place par Agilitation \n\n2.'],1.0,0.9688236349257694,0.5
5,Sur quoi prévaut le contract et ses règles de collaboration?,"Le contrat et ses règles de collaboration prévalent sur tout autre document contractuel. Il peut être complété par des annexes qui peuvent y déroger et/ou le compléter dès lors qu’elles sont signées par les parties. Les parties, en signant le contrat, déclarent avoir pu exprimer toutes leurs demandes et avoir obtenu toutes les réponses à leurs questions. Elles déclarent également avoir parfaitement compris et accepté le périmètre des missions confiées.","['Objet du contrat. \na.Le Contrat fixe les règles de collaboration entre les parties et prime sur tout autre document contractuel qui est dès lors inopposable à Agilitation. \nb.Le Contrat peut être complété par des annexes qui peuvent y déroger et/ou le compléter dès lors qu’elles sont signées par les Parties. \n\n3.Compréhension des objectifs poursuivis par le Contrat. \na.En signant le Contrat, les Parties déclarent qu’elles ont pu exprimer l’ensemble de leurs demandes. \nb.Les Parties déclarent qu’elles ont pu obtenir toutes les réponses à leurs questions et que le périmètre des missions confiées a parfaitement été compris et accepté.']",1.0,0.9298288318199229,0.16666666666666666
6,Par quoi peut être complété le contract?,Le contrat peut être complété par des annexes qui peuvent y déroger et/ou le compléter dès lors qu’elles sont signées par les Parties.,"['Objet du contrat. \na.Le Contrat fixe les règles de collaboration entre les parties et prime sur tout autre document contractuel qui est dès lors inopposable à Agilitation. \nb.Le Contrat peut être complété par des annexes qui peuvent y déroger et/ou le compléter dès lors qu’elles sont signées par les Parties. \n\n3.Compréhension des objectifs poursuivis par le Contrat. \na.En signant le Contrat, les Parties déclarent qu’elles ont pu exprimer l’ensemble de leurs demandes. \nb.Les Parties déclarent qu’elles ont pu obtenir toutes les réponses à leurs questions et que le périmètre des missions confiées a parfaitement été compris et accepté.']",0.75,0.9191200665119185,0.16666666666666666
7,Quelle est la condition pour que les annexes dérogent ou complètent le contract?,La condition pour que les annexes dérogent ou complètent le contrat est qu'elles doivent être rédigées séparément et jointes au contrat. Elles s'intègrent aux Conditions Générales de Vente (CGP) et constituent un tout indissociable avec le contrat.,[' \n- Annexe(s) : désigne le(s) document(s) que les parties rédigent séparément et joignent au contrat. L’annexe s’intègre aux CGP et constitue un tout indissociable avec lui.'],0.75,0.9978159382516166,0.5
8,La signature du contract par les parties engage ...,"La signature du contrat par les parties engage leur collaboration selon les règles fixées par le contrat. Ce dernier prime sur tout autre document contractuel. Cependant, le contrat peut être complété par des annexes, à condition qu'elles soient signées par les parties. En signant le contrat, les parties déclarent avoir pu exprimer toutes leurs demandes et avoir obtenu toutes les réponses à leurs questions. Elles déclarent également avoir parfaitement compris et accepté le périmètre des missions confiées.","['Objet du contrat. \na.Le Contrat fixe les règles de collaboration entre les parties et prime sur tout autre document contractuel qui est dès lors inopposable à Agilitation. \nb.Le Contrat peut être complété par des annexes qui peuvent y déroger et/ou le compléter dès lors qu’elles sont signées par les Parties. \n\n3.Compréhension des objectifs poursuivis par le Contrat. \na.En signant le Contrat, les Parties déclarent qu’elles ont pu exprimer l’ensemble de leurs demandes. \nb.Les Parties déclarent qu’elles ont pu obtenir toutes les réponses à leurs questions et que le périmètre des missions confiées a parfaitement été compris et accepté.']",1.0,0.8323566753355695,0.8333333333333334
9,Les parties doivent-elles colllaborer pour atteindre l'objectif? Ou bien que l'une des deux?,Les documents indiquent que les deux parties doivent collaborer activement pour atteindre l'objectif de leur partenariat.,"['Collaboration des parties\na.Les Parties conviennent de collaborer activement pour atteindre les objectifs de leur partenariat.\nb.Quand la mise en place d’une démarche nécessite un accord préalable d’une Partie, les Parties font preuve de réactivité pour formaliser une réponse.\nc.Les Parties se communiquent les éléments nécessaires à la réalisation des prestations dans les meilleurs délais ou dans le respect des dispositions particulières prévues entre eux.']",1.0,0.907362056700804,0.25
10,Que dire de la contrainte à répondre en temps limité?,The document provided does not contain information on the constraint of responding within a limited time.,['Obligation générale de conseil.'],,0.8609658712930509,1.0
11,Par quelle considérations se termine le contract?,The documents provided do not provide information on how the contract is terminated.,"['Objet du contrat. \na.Le Contrat fixe les règles de collaboration entre les parties et prime sur tout autre document contractuel qui est dès lors inopposable à Agilitation. \nb.Le Contrat peut être complété par des annexes qui peuvent y déroger et/ou le compléter dès lors qu’elles sont signées par les Parties. \n\n3.Compréhension des objectifs poursuivis par le Contrat. \na.En signant le Contrat, les Parties déclarent qu’elles ont pu exprimer l’ensemble de leurs demandes. \nb.Les Parties déclarent qu’elles ont pu obtenir toutes les réponses à leurs questions et que le périmètre des missions confiées a parfaitement été compris et accepté.']",,0.0,0.16666666666666666
12,Sous traitance de tâches et conditions,"La sous-traitance de tâches est possible dans le cadre de ce contrat, à condition que les règles spécifiques à ce cas soient respectées comme stipulé dans le contrat. Cependant, le partenaire ne peut pas transférer ou céder une partie ou la totalité de ses droits et obligations à une autre personne sans l'accord écrit d'Agilitation. Cela est dû à la nature intuitu personae du contrat, qui est conclu en considération des qualités spécifiques du partenaire.","['Intuitu personae\na.Le contrat est conclu en considération des qualités du Partenaire (intuitu personae)\nb.Le Partenaire ne peut pas transférer ou céder une partie ou la totalité des droits et obligations prévus par le Contrat et/ ou ses Annexes à quelqu’un d’autre, sauf accord écrit d’Agilitation.\nc.Le Partenaire peut cependant sous-traiter certaines de ses missions, sous réserve du respect des règles qui s’appliquent à ce cas de figure dans le Contrat.']",1.0,0.8497368525828662,0.25
13,Les raisons d'avoir un référent pour chaque partie,"Avoir un référent pour chaque partie dans un projet est important pour plusieurs raisons. 

Premièrement, cela permet de fluidifier les échanges entre les différentes parties. En effet, le référent est la personne qui sera en charge de la communication entre les parties, ce qui permet d'éviter les malentendus et les retards dans la communication.

Deuxièmement, le référent est également en mesure d'accepter ou de refuser rapidement les propositions techniques proposées par le partenaire. Cela permet d'accélérer le processus de décision et d'éviter les retards dans la mise en place et le déploiement des prestations attendues.

Enfin, le référent est également responsable de faire les choix nécessaires à l'avancée des missions. Cela permet d'assurer que le projet avance selon le plan prévu et que toutes les parties sont sur la même longueur d'onde en ce qui concerne les objectifs et les attentes du projet.

En somme, avoir un référent pour chaque partie dans un projet permet d'améliorer la communication, d'accélérer le processus de décision et de garantir que le projet avance selon le plan prévu.","['Personnel référant, désignation & remplacement. \na.Les parties peuvent désigner chacune une personne référente sur les projets en cours pour fluidifier les échanges. \nb. Ces personnes doivent alors être en mesure d’accepter ou de refuser rapidement les propositions techniques proposées par le Partenaire et de faire les choix nécessaires à l’avancée des missions pour éviter des retards de mise en place et/ou de déploiements des prestations attendues.']",1.0,0.9383504092559428,0.3333333333333333
14,Les devoirs des référents,"Les devoirs des référents comprennent la désignation par les parties pour faciliter les échanges sur les projets en cours. Ils doivent être capables d'accepter ou de refuser rapidement les propositions techniques proposées par le partenaire. De plus, ils sont responsables de faire les choix nécessaires pour faire avancer les missions et éviter les retards dans la mise en place et/ou le déploiement des services attendus.","['Personnel référant, désignation & remplacement. \na.Les parties peuvent désigner chacune une personne référente sur les projets en cours pour fluidifier les échanges. \nb. Ces personnes doivent alors être en mesure d’accepter ou de refuser rapidement les propositions techniques proposées par le Partenaire et de faire les choix nécessaires à l’avancée des missions pour éviter des retards de mise en place et/ou de déploiements des prestations attendues.']",1.0,0.9289356359339126,0.3333333333333333
15,Passage relatif au remplacement des référents,"1. Comment les référents sont-ils désignés pour les projets en cours?

Les parties impliquées dans les projets en cours peuvent chacune désigner une personne référente pour faciliter les échanges.

2. Quel est le rôle des référents dans les projets?

Les référents doivent être en mesure d'accepter ou de refuser rapidement les propositions techniques proposées par le Partenaire. Ils doivent également être capables de faire les choix nécessaires pour faire avancer les missions et éviter des retards dans la mise en place et/ou le déploiement des prestations attendues.

3. Comment se fait le remplacement des référents?

Le document ne fournit pas d'informations spécifiques sur le processus de remplacement des référents.","['Personnel référant, désignation & remplacement. \na.Les parties peuvent désigner chacune une personne référente sur les projets en cours pour fluidifier les échanges. \nb. Ces personnes doivent alors être en mesure d’accepter ou de refuser rapidement les propositions techniques proposées par le Partenaire et de faire les choix nécessaires à l’avancée des missions pour éviter des retards de mise en place et/ou de déploiements des prestations attendues.']",0.6666666666666666,0.0,1.0
16,Où sont détaillées les missions,Les missions du Partenaire sont détaillées avec précision en Annexe du Contrat.,['Missions \na.Les missions du Partenaire sont détaillées avec précision en Annexe du Contrat. \nb.Le Partenaire rend compte de ses missions dans les conditions prévues au Contrat. \nc.Agilitation demeure en tout état de cause seule décisionnaire finale des choix stratégiques opérés pour la mise en place différentes actions réalisées par le Partenaire.'],1.0,0.9286201989893644,0.25
17,Quelle est l'obligation générale du Partenaire dans l'exécution de ses missions ?,"L'obligation générale du Partenaire dans l'exécution de ses missions est de fournir des conseils, de respecter la réglementation en vigueur, d'effectuer les prestations et/ou de remettre les livrables libres de tous droits dans la limite des recherches pouvant être accomplies et de l'information fournie par Agilitation. De manière générale, le Partenaire doit également rendre tous les services qu'une partie est raisonnablement en droit d'attendre, en respectant les règles de l'art.","[""Le Partenaire est tenu dans l’exécution de ses missions à une obligation générale de conseil et de respect de la réglementation en vigueur. \nb.Le Partenaire s’engage notamment à effectuer les prestations et/ou à remettre les livrables libre(s) de tous droits dans la limite des recherches pouvant être accomplies et de l’information qu’Agilitation lui aura communiqué. \nc.De manière générale le Partenaire rendra tous les services qu’une partie est raisonnablement en droit d'attendre s’agissant des prestations visées dans les Annexes (respect des règles de l’art par le Partenaire).""]",1.0,0.9931847974130829,1.0
18,Quels sont les engagements du Partenaire concernant les moyens humains et matériels nécessaires à ses missions ?,"Le Partenaire s'engage à fournir les moyens humains et matériels nécessaires pour la bonne réalisation de ses missions. Il assure également le contrôle de ces moyens par des personnels expérimentés. De plus, le Partenaire est responsable du suivi des prestations auxquelles il s'est engagé, en contrôlant leur bonne exécution et en formulant des réclamations éventuelles auprès des fournisseurs si nécessaire. Il défend activement les intérêts d'Agilitation pour obtenir satisfaction.",['Le Partenaire s’engage à fournir les moyens humains et matériels nécessaires à la bonne réalisation de ses missions et veille à assurer leur contrôle par des personnels expérimentés. \ne.Le Partenaire assure le suivi des prestations auxquelles il s’est engagé en contrôlant leur bonne exécution par les Partenaires sollicités et en formulant les réclamations éventuelles auprès des fournisseurs et en défendant activement les intérêts d’Agilitation pour obtenir satisfaction si nécessaire.'],1.0,0.8983639787240856,1.0
19,"Quelle obligation le Partenaire est-il soumis pour l'ensemble des prestations, sauf disposition contraire en Annexe ?","Le Partenaire est soumis à une obligation de moyen pour l'ensemble des prestations, sauf disposition contraire en Annexe.","['Obligation de moyen \na.Sauf dispositions contraire prévues en Annexe, le Partenaire est soumis pour l’ensemble des prestations auxquelles il s’engage à une obligation de moyen.']",1.0,0.93854258354467,0.5
20,Que doit céder le partenaire sous réserve du respect de la contrepartie prévue à l’accord?,"Le partenaire doit céder les prestations et/ou les livrables libre(s) de tous droits, tout en respectant la réglementation en vigueur et en fournissant tous les services qu'une partie est raisonnablement en droit d'attendre.","[""Le Partenaire est tenu dans l’exécution de ses missions à une obligation générale de conseil et de respect de la réglementation en vigueur. \nb.Le Partenaire s’engage notamment à effectuer les prestations et/ou à remettre les livrables libre(s) de tous droits dans la limite des recherches pouvant être accomplies et de l’information qu’Agilitation lui aura communiqué. \nc.De manière générale le Partenaire rendra tous les services qu’une partie est raisonnablement en droit d'attendre s’agissant des prestations visées dans les Annexes (respect des règles de l’art par le Partenaire).""]",1.0,0.8759984820969784,0.3333333333333333
21,que veut dire LAD?,"LAD signifie ""lecture automatique de documents"". Il s'agit d'un processus avancé de capture de données sur des documents structurés et non structurés. L'objectif n'est pas d'archiver des documents, mais d'alimenter un système d'informations avec les données contenues dans les documents numérisés.","['Ne pas confondre reconnaissance automatique de documents, ou RAD, ou de type de documents et lecture automatique de documents (LAD). \nEn effet, si la reconnaissance de caractères ou de formes et autres cases à cocher permet de distinguer un document d’un autre ainsi que certains mots contenus de manière à alimenter une base d’index destinée à une gestion électronique de documents, l’appellation LAD, pour lecture automatique de documents, concerne les processus évolués de capture de données sur des documents structurés et désormais aussi non structurés.\nL’objectif n’est pas d’archiver des documents, mais d’alimenter un système d’informations (souvent un système de GED) avec les données contenues dans les documents numérisés dans le cadre de processus de type industriel.']",1.0,0.9488583073841422,0.3333333333333333
22,Un gros avantage des solution de type LAD?,"Un gros avantage des solutions de type LAD (Lecture Automatique de Documents) est leur capacité à fournir la totalité des informations attendues par le système d'informations, en bout de chaîne de traitement.","["" La richesse d’une solution avancée de LAD réside dans sa capacité à fournir, en bout de chaîne de traitement, la totalité des informations attendues par le système d'informations lui-même.""]",1.0,0.9852050710029664,1.0
23,A quel champ appartient la reconnaissance faciale?,La reconnaissance faciale appartient au champ de la vision par ordinateur.,"[""\n\nUn système de reconnaissance faciale est une application logicielle visant à reconnaître automatiquement une personne grâce à son visage. Il s'agit d'un sujet particulièrement étudié en vision par ordinateur, avec de très nombreuses publications et brevets, et des conférences spécialisées.\nLa reconnaissance de visage a de nombreuses applications en vidéosurveillance, sécurité, biométrie, photographie, médecine, robotique, indexation d'images et de vidéos, recherche d'images par le contenu, etc. Ces systèmes sont généralement utilisés à des fins de sécurité publique ou de protection de la vie privée ou de données privées ou d'entreprises, dont pour déverrouiller ordinateur/mobile/console, mais aussi en domotique. Le fonctionnement de ces systèmes se base sur une ou plusieurs caméras pour reconnaître l'utilisateur.""]",1.0,0.9732512777865815,1.0
24,Parles moi de l'angoument médiatique et scientifique de la vision par ordinateur,"La vision par ordinateur est un domaine de recherche en pleine expansion, avec un intérêt croissant de la part des médias et de la communauté scientifique. Cela est dû en grande partie à l'essor des systèmes de reconnaissance faciale, une application logicielle qui permet de reconnaître automatiquement une personne grâce à son visage. Ce sujet est particulièrement étudié en vision par ordinateur, avec de nombreuses publications, brevets et conférences spécialisées.

La reconnaissance faciale a de nombreuses applications, notamment en vidéosurveillance, sécurité, biométrie, photographie, médecine, robotique, indexation d'images et de vidéos, recherche d'images par le contenu, etc. Ces systèmes sont généralement utilisés à des fins de sécurité publique ou de protection de la vie privée ou de données privées ou d'entreprises, dont pour déverrouiller ordinateur/mobile/console, mais aussi en domotique. Le fonctionnement de ces systèmes se base sur une ou plusieurs caméras pour reconnaître l'utilisateur.

L'engouement médiatique et scientifique pour la vision par ordinateur est donc lié à la multitude d'applications possibles de la reconnaissance faciale, ainsi qu'à son potentiel en termes de sécurité et de protection de la vie privée. Cependant, cette technologie soulève également des questions éthiques et légales, notamment en ce qui concerne le respect de la vie privée et les risques d'abus.","[""\n\nUn système de reconnaissance faciale est une application logicielle visant à reconnaître automatiquement une personne grâce à son visage. Il s'agit d'un sujet particulièrement étudié en vision par ordinateur, avec de très nombreuses publications et brevets, et des conférences spécialisées.\nLa reconnaissance de visage a de nombreuses applications en vidéosurveillance, sécurité, biométrie, photographie, médecine, robotique, indexation d'images et de vidéos, recherche d'images par le contenu, etc. Ces systèmes sont généralement utilisés à des fins de sécurité publique ou de protection de la vie privée ou de données privées ou d'entreprises, dont pour déverrouiller ordinateur/mobile/console, mais aussi en domotique. Le fonctionnement de ces systèmes se base sur une ou plusieurs caméras pour reconnaître l'utilisateur.""]",0.8333333333333334,0.7977967757279768,0.8
25,Application concrètes de la vision par ordinateur,"Les applications concrètes de la vision par ordinateur comprennent la reconnaissance faciale, qui est largement utilisée dans divers domaines. En vidéosurveillance et en sécurité, elle permet d'identifier automatiquement une personne à partir de son visage. En biométrie, elle est utilisée pour authentifier l'identité d'une personne, par exemple pour déverrouiller un ordinateur, un mobile ou une console. En photographie et en médecine, elle peut aider à analyser et à indexer des images. En robotique, elle peut aider les robots à interagir de manière plus naturelle avec leur environnement. Enfin, en matière d'indexation d'images et de vidéos et de recherche d'images par le contenu, elle peut aider à organiser et à rechercher des informations visuelles.","[""\n\nUn système de reconnaissance faciale est une application logicielle visant à reconnaître automatiquement une personne grâce à son visage. Il s'agit d'un sujet particulièrement étudié en vision par ordinateur, avec de très nombreuses publications et brevets, et des conférences spécialisées.\nLa reconnaissance de visage a de nombreuses applications en vidéosurveillance, sécurité, biométrie, photographie, médecine, robotique, indexation d'images et de vidéos, recherche d'images par le contenu, etc. Ces systèmes sont généralement utilisés à des fins de sécurité publique ou de protection de la vie privée ou de données privées ou d'entreprises, dont pour déverrouiller ordinateur/mobile/console, mais aussi en domotique. Le fonctionnement de ces systèmes se base sur une ou plusieurs caméras pour reconnaître l'utilisateur.""]",1.0,0.9550044126201529,1.0
26,Dans quel processus la LAD fait elle son essor?,La LAD fait son essor dans le processus de dématérialisation.,"[""\n\nLa LAD prend une importance croissante dans les processus de dématérialisation où elle apparaît comme un axe de productivité.\nLa LAD permet, par exemple, d’accélérer le traitement des factures fournisseurs :\narchivage et indexation automatique de l'image du document ;\n(pré)saisie automatisée des écritures comptables (montants HT, TTC...).\nLa saisie des factures et, de façon plus générale, des documents transactionnels tels que bons de livraison ou bons de commande permet de réaliser des progrès dans l’organisation en fiabilisant les procédures de traitement avec une alimentation plus rapide du système d’information.""]",1.0,0.9233736000737335,1.0
27,Quelles sont les applications de la LAD?,"La LAD (Lecture Automatique de Documents) a plusieurs applications. Elle est particulièrement utile dans les processus de dématérialisation, où elle contribue à l'amélioration de la productivité. Elle permet d'accélérer le traitement des factures fournisseurs grâce à l'archivage et l'indexation automatique de l'image du document, ainsi que la saisie automatisée des écritures comptables. De plus, la LAD peut être utilisée pour la saisie des documents transactionnels tels que les bons de livraison ou les bons de commande, ce qui permet d'améliorer l'organisation et la fiabilité des procédures de traitement tout en alimentant plus rapidement le système d'information.","[""\n\nLa LAD prend une importance croissante dans les processus de dématérialisation où elle apparaît comme un axe de productivité.\nLa LAD permet, par exemple, d’accélérer le traitement des factures fournisseurs :\narchivage et indexation automatique de l'image du document ;\n(pré)saisie automatisée des écritures comptables (montants HT, TTC...).\nLa saisie des factures et, de façon plus générale, des documents transactionnels tels que bons de livraison ou bons de commande permet de réaliser des progrès dans l’organisation en fiabilisant les procédures de traitement avec une alimentation plus rapide du système d’information.""]",1.0,1.0000000000000009,0.8
