,question,answer,contexts,faithfulness,answer_relevancy,context_relevancy
0,Quelle est le but de définir certain termes dans les GCP?,Le but de définir certains termes dans les CGP (Conditions Générales de Partenariat) est d'éviter toute ambigüité entre les parties quant à leur signification exacte. Ces définitions s'imposent aux parties et permettent une meilleure compréhension et interprétation du contrat.,"['Agilitaton – Conditons générales de partenariat \n\n1.Définitons de certains termes applicables aux CGP \n\na.Dans les CGP, certains termes font l’objet d’une définition prévue dans cet article afin d’éviter toute ambigüité entre les parties quant à leur signification exacte. \nb.Ces définitions s’imposent donc aux Parties. \n- Annexe(s) : désigne le(s) document(s) que les parties rédigent séparément et joignent au contrat. L’annexe s’intègre aux CGP et constitue un tout indissociable avec lui. Contrat ou CGP : il s’agit des présentes conditions générales également \n- Obligation de moyen : engagement contractuel qui astreint une Partie à mettre en œuvre les moyens et techniques les plus efficaces connus au jour de la signature de la convention pour atteindre le résultat fixé par le contrat. \n- Partie(s) : ce terme désigne individuellement ou collectivement le Partenaire et Agilitation \n- Partenaire : désigne la Partie qui contracte avec la SAS Agilitation. \n- RGPD : ou « règlement général sur la protection des données » Règlement (UE) 2016/679 du Parlement Européen et du Conseil du 27 avril 2016 : il s’agit du règlement européen protégeant les données à caractère personnelles Supports : partenaires commerciaux supports de diffusion des campagnes de marketing mises en place par Agilitation \n\n2.']",1.0,0.9385770436469906,0.08333333333333333
1,l'annexe peut-elle être séparée des GCP?,"Non, l'annexe ne peut pas être séparée des CGP. Selon la définition fournie dans le document, l'annexe est un document que les parties rédigent séparément et joignent au contrat. Elle s'intègre aux CGP et constitue un tout indissociable avec lui.","['Agilitaton – Conditons générales de partenariat \n\n1.Définitons de certains termes applicables aux CGP \n\na.Dans les CGP, certains termes font l’objet d’une définition prévue dans cet article afin d’éviter toute ambigüité entre les parties quant à leur signification exacte. \nb.Ces définitions s’imposent donc aux Parties. \n- Annexe(s) : désigne le(s) document(s) que les parties rédigent séparément et joignent au contrat. L’annexe s’intègre aux CGP et constitue un tout indissociable avec lui. Contrat ou CGP : il s’agit des présentes conditions générales également \n- Obligation de moyen : engagement contractuel qui astreint une Partie à mettre en œuvre les moyens et techniques les plus efficaces connus au jour de la signature de la convention pour atteindre le résultat fixé par le contrat. \n- Partie(s) : ce terme désigne individuellement ou collectivement le Partenaire et Agilitation \n- Partenaire : désigne la Partie qui contracte avec la SAS Agilitation. \n- RGPD : ou « règlement général sur la protection des données » Règlement (UE) 2016/679 du Parlement Européen et du Conseil du 27 avril 2016 : il s’agit du règlement européen protégeant les données à caractère personnelles Supports : partenaires commerciaux supports de diffusion des campagnes de marketing mises en place par Agilitation \n\n2.']",1.0,0.9376925385316305,0.08333333333333333
2,Par quel terem générique est désigné le GCP?,"Le terme générique par lequel est désigné le GCP dans ce document est ""Contrat ou CGP"", qui signifie ""conditions générales de partenariat"".","['Agilitaton – Conditons générales de partenariat \n\n1.Définitons de certains termes applicables aux CGP \n\na.Dans les CGP, certains termes font l’objet d’une définition prévue dans cet article afin d’éviter toute ambigüité entre les parties quant à leur signification exacte. \nb.Ces définitions s’imposent donc aux Parties. \n- Annexe(s) : désigne le(s) document(s) que les parties rédigent séparément et joignent au contrat. L’annexe s’intègre aux CGP et constitue un tout indissociable avec lui. Contrat ou CGP : il s’agit des présentes conditions générales également \n- Obligation de moyen : engagement contractuel qui astreint une Partie à mettre en œuvre les moyens et techniques les plus efficaces connus au jour de la signature de la convention pour atteindre le résultat fixé par le contrat. \n- Partie(s) : ce terme désigne individuellement ou collectivement le Partenaire et Agilitation \n- Partenaire : désigne la Partie qui contracte avec la SAS Agilitation. \n- RGPD : ou « règlement général sur la protection des données » Règlement (UE) 2016/679 du Parlement Européen et du Conseil du 27 avril 2016 : il s’agit du règlement européen protégeant les données à caractère personnelles Supports : partenaires commerciaux supports de diffusion des campagnes de marketing mises en place par Agilitation \n\n2.']",1.0,0.9240745200382063,0.08333333333333333
3,Quelle est la signification de RGPD?,"La signification de RGPD est ""règlement général sur la protection des données"". Il s'agit du Règlement (UE) 2016/679 du Parlement Européen et du Conseil du 27 avril 2016, qui est un règlement européen protégeant les données à caractère personnel.","['Agilitaton – Conditons générales de partenariat \n\n1.Définitons de certains termes applicables aux CGP \n\na.Dans les CGP, certains termes font l’objet d’une définition prévue dans cet article afin d’éviter toute ambigüité entre les parties quant à leur signification exacte. \nb.Ces définitions s’imposent donc aux Parties. \n- Annexe(s) : désigne le(s) document(s) que les parties rédigent séparément et joignent au contrat. L’annexe s’intègre aux CGP et constitue un tout indissociable avec lui. Contrat ou CGP : il s’agit des présentes conditions générales également \n- Obligation de moyen : engagement contractuel qui astreint une Partie à mettre en œuvre les moyens et techniques les plus efficaces connus au jour de la signature de la convention pour atteindre le résultat fixé par le contrat. \n- Partie(s) : ce terme désigne individuellement ou collectivement le Partenaire et Agilitation \n- Partenaire : désigne la Partie qui contracte avec la SAS Agilitation. \n- RGPD : ou « règlement général sur la protection des données » Règlement (UE) 2016/679 du Parlement Européen et du Conseil du 27 avril 2016 : il s’agit du règlement européen protégeant les données à caractère personnelles Supports : partenaires commerciaux supports de diffusion des campagnes de marketing mises en place par Agilitation \n\n2.']",1.0,0.9999999999999997,0.08333333333333333
4,De quand date le RGPD?,Le RGPD date du 27 avril 2016.,"['Agilitaton – Conditons générales de partenariat \n\n1.Définitons de certains termes applicables aux CGP \n\na.Dans les CGP, certains termes font l’objet d’une définition prévue dans cet article afin d’éviter toute ambigüité entre les parties quant à leur signification exacte. \nb.Ces définitions s’imposent donc aux Parties. \n- Annexe(s) : désigne le(s) document(s) que les parties rédigent séparément et joignent au contrat. L’annexe s’intègre aux CGP et constitue un tout indissociable avec lui. Contrat ou CGP : il s’agit des présentes conditions générales également \n- Obligation de moyen : engagement contractuel qui astreint une Partie à mettre en œuvre les moyens et techniques les plus efficaces connus au jour de la signature de la convention pour atteindre le résultat fixé par le contrat. \n- Partie(s) : ce terme désigne individuellement ou collectivement le Partenaire et Agilitation \n- Partenaire : désigne la Partie qui contracte avec la SAS Agilitation. \n- RGPD : ou « règlement général sur la protection des données » Règlement (UE) 2016/679 du Parlement Européen et du Conseil du 27 avril 2016 : il s’agit du règlement européen protégeant les données à caractère personnelles Supports : partenaires commerciaux supports de diffusion des campagnes de marketing mises en place par Agilitation \n\n2.']",1.0,0.9478582007845769,0.25
5,Sur quoi prévaut le contract et ses règles de collaboration?,"Le contrat et ses règles de collaboration prévalent sur la collaboration entre les parties. Il prime sur tout autre document contractuel et peut être complété par des annexes si elles sont signées par les parties. Les parties s'engagent à collaborer activement pour atteindre les objectifs du contrat, à communiquer les éléments nécessaires à la réalisation des prestations dans les meilleurs délais et à faire preuve de réactivité pour formaliser une réponse lorsque la mise en place d'une démarche nécessite un accord préalable.","['Objet du contrat. \na.Le Contrat fixe les règles de collaboration entre les parties et prime sur tout autre document contractuel qui est dès lors inopposable à Agilitation. \nb.Le Contrat peut être complété par des annexes qui peuvent y déroger et/ou le compléter dès lors qu’elles sont signées par les Parties. \n\n3.Compréhension des objectifs poursuivis par le Contrat. \na.En signant le Contrat, les Parties déclarent qu’elles ont pu exprimer l’ensemble de leurs demandes. \nb.Les Parties déclarent qu’elles ont pu obtenir toutes les réponses à leurs questions et que le périmètre des missions confiées a parfaitement été compris et accepté.\n\n\n4.Collaboration des parties\na.Les Parties conviennent de collaborer activement pour atteindre les objectifs de leur partenariat.\nb.Quand la mise en place d’une démarche nécessite un accord préalable d’une Partie, les Parties font preuve de réactivité pour formaliser une réponse.\nc.Les Parties se communiquent les éléments nécessaires à la réalisation des prestations dans les meilleurs délais ou dans le respect des dispositions particulières prévues entre eux.']",1.0,0.9370113224382847,0.1
6,Par quoi peut être complété le contract?,Le contrat peut être complété par des annexes qui peuvent y déroger et/ou le compléter dès lors qu’elles sont signées par les Parties.,"['Objet du contrat. \na.Le Contrat fixe les règles de collaboration entre les parties et prime sur tout autre document contractuel qui est dès lors inopposable à Agilitation. \nb.Le Contrat peut être complété par des annexes qui peuvent y déroger et/ou le compléter dès lors qu’elles sont signées par les Parties. \n\n3.Compréhension des objectifs poursuivis par le Contrat. \na.En signant le Contrat, les Parties déclarent qu’elles ont pu exprimer l’ensemble de leurs demandes. \nb.Les Parties déclarent qu’elles ont pu obtenir toutes les réponses à leurs questions et que le périmètre des missions confiées a parfaitement été compris et accepté.\n\n\n4.Collaboration des parties\na.Les Parties conviennent de collaborer activement pour atteindre les objectifs de leur partenariat.\nb.Quand la mise en place d’une démarche nécessite un accord préalable d’une Partie, les Parties font preuve de réactivité pour formaliser une réponse.\nc.Les Parties se communiquent les éléments nécessaires à la réalisation des prestations dans les meilleurs délais ou dans le respect des dispositions particulières prévues entre eux.']",1.0,0.9248237024318108,0.1
7,Quelle est la condition pour que les annexes dérogent ou complètent le contract?,La condition pour que les annexes dérogent ou complètent le contrat est qu'elles soient signées par les parties.,"['Objet du contrat. \na.Le Contrat fixe les règles de collaboration entre les parties et prime sur tout autre document contractuel qui est dès lors inopposable à Agilitation. \nb.Le Contrat peut être complété par des annexes qui peuvent y déroger et/ou le compléter dès lors qu’elles sont signées par les Parties. \n\n3.Compréhension des objectifs poursuivis par le Contrat. \na.En signant le Contrat, les Parties déclarent qu’elles ont pu exprimer l’ensemble de leurs demandes. \nb.Les Parties déclarent qu’elles ont pu obtenir toutes les réponses à leurs questions et que le périmètre des missions confiées a parfaitement été compris et accepté.\n\n\n4.Collaboration des parties\na.Les Parties conviennent de collaborer activement pour atteindre les objectifs de leur partenariat.\nb.Quand la mise en place d’une démarche nécessite un accord préalable d’une Partie, les Parties font preuve de réactivité pour formaliser une réponse.\nc.Les Parties se communiquent les éléments nécessaires à la réalisation des prestations dans les meilleurs délais ou dans le respect des dispositions particulières prévues entre eux.']",1.0,0.9978159382516166,0.1
8,La signature du contract par les parties engage ...,"La signature du contrat par les parties engage leur collaboration active pour atteindre les objectifs du partenariat, en respectant les règles fixées par le contrat. Ce dernier peut être complété par des annexes, à condition qu'elles soient signées par les parties. En signant le contrat, les parties déclarent avoir pu exprimer toutes leurs demandes et avoir obtenu toutes les réponses à leurs questions. Elles s'engagent également à communiquer les éléments nécessaires à la réalisation des prestations dans les meilleurs délais.","['Objet du contrat. \na.Le Contrat fixe les règles de collaboration entre les parties et prime sur tout autre document contractuel qui est dès lors inopposable à Agilitation. \nb.Le Contrat peut être complété par des annexes qui peuvent y déroger et/ou le compléter dès lors qu’elles sont signées par les Parties. \n\n3.Compréhension des objectifs poursuivis par le Contrat. \na.En signant le Contrat, les Parties déclarent qu’elles ont pu exprimer l’ensemble de leurs demandes. \nb.Les Parties déclarent qu’elles ont pu obtenir toutes les réponses à leurs questions et que le périmètre des missions confiées a parfaitement été compris et accepté.\n\n\n4.Collaboration des parties\na.Les Parties conviennent de collaborer activement pour atteindre les objectifs de leur partenariat.\nb.Quand la mise en place d’une démarche nécessite un accord préalable d’une Partie, les Parties font preuve de réactivité pour formaliser une réponse.\nc.Les Parties se communiquent les éléments nécessaires à la réalisation des prestations dans les meilleurs délais ou dans le respect des dispositions particulières prévues entre eux.']",1.0,0.8781838853770129,0.1
9,Les parties doivent-elles colllaborer pour atteindre l'objectif? Ou bien que l'une des deux?,"Les parties doivent collaborer pour atteindre l'objectif. C'est clairement indiqué dans la section 4a qui stipule que ""Les Parties conviennent de collaborer activement pour atteindre les objectifs de leur partenariat.""","['Objet du contrat. \na.Le Contrat fixe les règles de collaboration entre les parties et prime sur tout autre document contractuel qui est dès lors inopposable à Agilitation. \nb.Le Contrat peut être complété par des annexes qui peuvent y déroger et/ou le compléter dès lors qu’elles sont signées par les Parties. \n\n3.Compréhension des objectifs poursuivis par le Contrat. \na.En signant le Contrat, les Parties déclarent qu’elles ont pu exprimer l’ensemble de leurs demandes. \nb.Les Parties déclarent qu’elles ont pu obtenir toutes les réponses à leurs questions et que le périmètre des missions confiées a parfaitement été compris et accepté.\n\n\n4.Collaboration des parties\na.Les Parties conviennent de collaborer activement pour atteindre les objectifs de leur partenariat.\nb.Quand la mise en place d’une démarche nécessite un accord préalable d’une Partie, les Parties font preuve de réactivité pour formaliser une réponse.\nc.Les Parties se communiquent les éléments nécessaires à la réalisation des prestations dans les meilleurs délais ou dans le respect des dispositions particulières prévues entre eux.']",1.0,0.7851804599109039,0.1
10,Que dire de la contrainte à répondre en temps limité?,"Les documents ne fournissent pas d'informations spécifiques sur la contrainte de répondre en temps limité. Cependant, ils soulignent l'importance de la réactivité et de la communication rapide entre les parties pour atteindre les objectifs du contrat. Les parties sont donc encouragées à répondre rapidement, mais aucun délai spécifique n'est mentionné.","['Objet du contrat. \na.Le Contrat fixe les règles de collaboration entre les parties et prime sur tout autre document contractuel qui est dès lors inopposable à Agilitation. \nb.Le Contrat peut être complété par des annexes qui peuvent y déroger et/ou le compléter dès lors qu’elles sont signées par les Parties. \n\n3.Compréhension des objectifs poursuivis par le Contrat. \na.En signant le Contrat, les Parties déclarent qu’elles ont pu exprimer l’ensemble de leurs demandes. \nb.Les Parties déclarent qu’elles ont pu obtenir toutes les réponses à leurs questions et que le périmètre des missions confiées a parfaitement été compris et accepté.\n\n\n4.Collaboration des parties\na.Les Parties conviennent de collaborer activement pour atteindre les objectifs de leur partenariat.\nb.Quand la mise en place d’une démarche nécessite un accord préalable d’une Partie, les Parties font preuve de réactivité pour formaliser une réponse.\nc.Les Parties se communiquent les éléments nécessaires à la réalisation des prestations dans les meilleurs délais ou dans le respect des dispositions particulières prévues entre eux.']",,0.0,0.1
11,Par quelle considérations se termine le contract?,The document does not provide information on how the contract is terminated.,"['Objet du contrat. \na.Le Contrat fixe les règles de collaboration entre les parties et prime sur tout autre document contractuel qui est dès lors inopposable à Agilitation. \nb.Le Contrat peut être complété par des annexes qui peuvent y déroger et/ou le compléter dès lors qu’elles sont signées par les Parties. \n\n3.Compréhension des objectifs poursuivis par le Contrat. \na.En signant le Contrat, les Parties déclarent qu’elles ont pu exprimer l’ensemble de leurs demandes. \nb.Les Parties déclarent qu’elles ont pu obtenir toutes les réponses à leurs questions et que le périmètre des missions confiées a parfaitement été compris et accepté.\n\n\n4.Collaboration des parties\na.Les Parties conviennent de collaborer activement pour atteindre les objectifs de leur partenariat.\nb.Quand la mise en place d’une démarche nécessite un accord préalable d’une Partie, les Parties font preuve de réactivité pour formaliser une réponse.\nc.Les Parties se communiquent les éléments nécessaires à la réalisation des prestations dans les meilleurs délais ou dans le respect des dispositions particulières prévues entre eux.']",,0.0,0.1
12,Sous traitance de tâches et conditions,"The question ""Sous traitance de tâches et conditions"" is not provided in your text. Could you please provide more details or context?",['Missions \na.Les missions du Partenaire sont détaillées avec précision en Annexe du Contrat. \nb.Le Partenaire rend compte de ses missions dans les conditions prévues au Contrat. \nc.Agilitation demeure en tout état de cause seule décisionnaire finale des choix stratégiques opérés pour la mise en place différentes actions réalisées par le Partenaire.'],,0.0,0.25
13,Les raisons d'avoir un référent pour chaque partie,"Avoir un référent pour chaque partie dans un contrat ou un projet est important pour plusieurs raisons. 

Premièrement, cela permet de fluidifier les échanges entre les parties. En effet, chaque partie a une personne désignée qui est responsable de la communication et de la coordination avec l'autre partie. Cela évite les malentendus et facilite la prise de décision.

Deuxièmement, le référent est en mesure d'accepter ou de refuser rapidement les propositions techniques proposées par l'autre partie. Cela permet d'éviter des retards de mise en place et/ou de déploiements des prestations attendues.

Troisièmement, en cas d'absence du référent, les parties sont tenues de remplacer sans délai le référent désigné. Cela garantit que le projet ne sera pas retardé en raison de l'absence d'une personne clé.

Enfin, si une partie n'a pas désigné de référent, elle ne peut s'opposer au défaut d'habilitation d'une personne et doit assumer la responsabilité liée à la demande formalisée par ce canal. Cela souligne l'importance d'avoir un référent désigné pour chaque partie.","['Intuitu personae\na.Le contrat est conclu en considération des qualités du Partenaire (intuitu personae)\nb.Le Partenaire ne peut pas transférer ou céder une partie ou la totalité des droits et obligations prévus par le Contrat et/ ou ses Annexes à quelqu’un d’autre, sauf accord écrit d’Agilitation.\nc.Le Partenaire peut cependant sous-traiter certaines de ses missions, sous réserve du respect des règles qui s’appliquent à ce cas de figure dans le Contrat.\n\n\n6.Personnel référant, désignation & remplacement. \na.Les parties peuvent désigner chacune une personne référente sur les projets en cours pour fluidifier les échanges. \nb. Ces personnes doivent alors être en mesure d’accepter ou de refuser rapidement les propositions techniques proposées par le Partenaire et de faire les choix nécessaires à l’avancée des missions pour éviter des retards de mise en place et/ou de déploiements des prestations attendues. \nc.Les parties remplacent sans délai le référent désigné dès que c’est nécessaire.\u2028d.Les parties s’informent sans délai de l’absence de ces \npersonnes si cela peut affecter le bon déroulement des \nmissions à accomplir.\u2028e.Les Parties ne peuvent s’opposer le défaut d’habilitation d’une personne si elles n’ont désigné aucun référent et devront assumer la responsabilité liée à la demande formalisée par ce canal.']",1.0,0.9339717116859703,0.08333333333333333
14,Les devoirs des référents,"Les devoirs des référents, tels que décrits dans les documents, comprennent:

1. Être en mesure d'accepter ou de refuser rapidement les propositions techniques proposées par le Partenaire.
2. Faire les choix nécessaires à l'avancée des missions pour éviter des retards de mise en place et/ou de déploiements des prestations attendues.
3. Informer sans délai les parties de leur absence si cela peut affecter le bon déroulement des missions à accomplir.
4. Être remplacé sans délai dès que c'est nécessaire.
5. Assumer la responsabilité liée à la demande formalisée par ce canal si aucune personne référente n'a été désignée. 

Il est également important de noter que le contrat est conclu en considération des qualités du Partenaire (intuitu personae) et que le Partenaire ne peut pas transférer ou céder une partie ou la totalité des droits et obligations prévus par le Contrat et/ ou ses Annexes à quelqu’un d’autre, sauf accord écrit d’Agilitation. Le Partenaire peut cependant sous-traiter certaines de ses missions, sous réserve du respect des règles qui s’appliquent à ce cas de figure dans le Contrat.","['Intuitu personae\na.Le contrat est conclu en considération des qualités du Partenaire (intuitu personae)\nb.Le Partenaire ne peut pas transférer ou céder une partie ou la totalité des droits et obligations prévus par le Contrat et/ ou ses Annexes à quelqu’un d’autre, sauf accord écrit d’Agilitation.\nc.Le Partenaire peut cependant sous-traiter certaines de ses missions, sous réserve du respect des règles qui s’appliquent à ce cas de figure dans le Contrat.\n\n\n6.Personnel référant, désignation & remplacement. \na.Les parties peuvent désigner chacune une personne référente sur les projets en cours pour fluidifier les échanges. \nb. Ces personnes doivent alors être en mesure d’accepter ou de refuser rapidement les propositions techniques proposées par le Partenaire et de faire les choix nécessaires à l’avancée des missions pour éviter des retards de mise en place et/ou de déploiements des prestations attendues. \nc.Les parties remplacent sans délai le référent désigné dès que c’est nécessaire.\u2028d.Les parties s’informent sans délai de l’absence de ces \npersonnes si cela peut affecter le bon déroulement des \nmissions à accomplir.\u2028e.Les Parties ne peuvent s’opposer le défaut d’habilitation d’une personne si elles n’ont désigné aucun référent et devront assumer la responsabilité liée à la demande formalisée par ce canal.']",1.0,0.8922525705312601,0.08333333333333333
15,Passage relatif au remplacement des référents,"Le remplacement des référents est possible et doit être effectué sans délai dès que cela est nécessaire. Les parties doivent s'informer mutuellement de l'absence de ces personnes si cela peut affecter le bon déroulement des missions à accomplir. Si aucune personne référente n'a été désignée, les parties ne peuvent s'opposer au défaut d'habilitation d'une personne et devront assumer la responsabilité liée à la demande formalisée par ce canal. Cependant, le partenaire ne peut pas transférer ou céder une partie ou la totalité de ses droits et obligations sans un accord écrit d'Agilitation, bien qu'il puisse sous-traiter certaines de ses missions.","['Intuitu personae\na.Le contrat est conclu en considération des qualités du Partenaire (intuitu personae)\nb.Le Partenaire ne peut pas transférer ou céder une partie ou la totalité des droits et obligations prévus par le Contrat et/ ou ses Annexes à quelqu’un d’autre, sauf accord écrit d’Agilitation.\nc.Le Partenaire peut cependant sous-traiter certaines de ses missions, sous réserve du respect des règles qui s’appliquent à ce cas de figure dans le Contrat.\n\n\n6.Personnel référant, désignation & remplacement. \na.Les parties peuvent désigner chacune une personne référente sur les projets en cours pour fluidifier les échanges. \nb. Ces personnes doivent alors être en mesure d’accepter ou de refuser rapidement les propositions techniques proposées par le Partenaire et de faire les choix nécessaires à l’avancée des missions pour éviter des retards de mise en place et/ou de déploiements des prestations attendues. \nc.Les parties remplacent sans délai le référent désigné dès que c’est nécessaire.\u2028d.Les parties s’informent sans délai de l’absence de ces \npersonnes si cela peut affecter le bon déroulement des \nmissions à accomplir.\u2028e.Les Parties ne peuvent s’opposer le défaut d’habilitation d’une personne si elles n’ont désigné aucun référent et devront assumer la responsabilité liée à la demande formalisée par ce canal.']",1.0,0.7828308214114683,0.08333333333333333
16,Où sont détaillées les missions,Les missions du Partenaire sont détaillées avec précision en Annexe du Contrat.,['Missions \na.Les missions du Partenaire sont détaillées avec précision en Annexe du Contrat. \nb.Le Partenaire rend compte de ses missions dans les conditions prévues au Contrat. \nc.Agilitation demeure en tout état de cause seule décisionnaire finale des choix stratégiques opérés pour la mise en place différentes actions réalisées par le Partenaire.'],1.0,0.9306374965651362,0.25
17,Quelle est l'obligation générale du Partenaire dans l'exécution de ses missions ?,"L'obligation générale du Partenaire dans l'exécution de ses missions est de respecter une obligation générale de conseil et de respect de la réglementation en vigueur. Il doit effectuer les prestations et/ou remettre les livrables libre(s) de tous droits dans la limite des recherches pouvant être accomplies et de l’information qu’Agilitation lui aura communiqué. Il doit également fournir les moyens humains et matériels nécessaires à la bonne réalisation de ses missions et assurer leur contrôle par des personnels expérimentés. Enfin, le Partenaire doit assurer le suivi des prestations auxquelles il s’est engagé en contrôlant leur bonne exécution et en défendant activement les intérêts d’Agilitation.","[""Obligation générale de conseil. \na.Le Partenaire est tenu dans l’exécution de ses missions à une obligation générale de conseil et de respect de la réglementation en vigueur. \nb.Le Partenaire s’engage notamment à effectuer les prestations et/ou à remettre les livrables libre(s) de tous droits dans la limite des recherches pouvant être accomplies et de l’information qu’Agilitation lui aura communiqué. \nc.De manière générale le Partenaire rendra tous les services qu’une partie est raisonnablement en droit d'attendre s’agissant des prestations visées dans les Annexes (respect des règles de l’art par le Partenaire). \nd.Le Partenaire s’engage à fournir les moyens humains et matériels nécessaires à la bonne réalisation de ses missions et veille à assurer leur contrôle par des personnels expérimentés. \ne.Le Partenaire assure le suivi des prestations auxquelles il s’est engagé en contrôlant leur bonne exécution par les Partenaires sollicités et en formulant les réclamations éventuelles auprès des fournisseurs et en défendant activement les intérêts d’Agilitation pour obtenir satisfaction si nécessaire.""]",1.0,0.9883156782917206,0.16666666666666666
18,Quels sont les engagements du Partenaire concernant les moyens humains et matériels nécessaires à ses missions ?,Les documents fournis ne donnent pas d'informations spécifiques sur les engagements du Partenaire concernant les moyens humains et matériels nécessaires à ses missions.,['Missions \na.Les missions du Partenaire sont détaillées avec précision en Annexe du Contrat. \nb.Le Partenaire rend compte de ses missions dans les conditions prévues au Contrat. \nc.Agilitation demeure en tout état de cause seule décisionnaire finale des choix stratégiques opérés pour la mise en place différentes actions réalisées par le Partenaire.'],0.0,0.9599084293391614,0.25
19,"Quelle obligation le Partenaire est-il soumis pour l'ensemble des prestations, sauf disposition contraire en Annexe ?","Le Partenaire est soumis à une obligation générale de conseil et de respect de la réglementation en vigueur pour l'ensemble des prestations, sauf disposition contraire en Annexe. Il s'engage également à effectuer les prestations et/ou à remettre les livrables libre(s) de tous droits, à fournir les moyens humains et matériels nécessaires à la bonne réalisation de ses missions, et à assurer le suivi des prestations en contrôlant leur bonne exécution et en défendant activement les intérêts d’Agilitation si nécessaire.","[""Obligation générale de conseil. \na.Le Partenaire est tenu dans l’exécution de ses missions à une obligation générale de conseil et de respect de la réglementation en vigueur. \nb.Le Partenaire s’engage notamment à effectuer les prestations et/ou à remettre les livrables libre(s) de tous droits dans la limite des recherches pouvant être accomplies et de l’information qu’Agilitation lui aura communiqué. \nc.De manière générale le Partenaire rendra tous les services qu’une partie est raisonnablement en droit d'attendre s’agissant des prestations visées dans les Annexes (respect des règles de l’art par le Partenaire). \nd.Le Partenaire s’engage à fournir les moyens humains et matériels nécessaires à la bonne réalisation de ses missions et veille à assurer leur contrôle par des personnels expérimentés. \ne.Le Partenaire assure le suivi des prestations auxquelles il s’est engagé en contrôlant leur bonne exécution par les Partenaires sollicités et en formulant les réclamations éventuelles auprès des fournisseurs et en défendant activement les intérêts d’Agilitation pour obtenir satisfaction si nécessaire.""]",1.0,0.909172989471338,0.16666666666666666
20,Que doit céder le partenaire sous réserve du respect de la contrepartie prévue à l’accord?,"Le partenaire doit céder les prestations et/ou les livrables libre(s) de tous droits. Il doit également fournir les moyens humains et matériels nécessaires à la bonne réalisation de ses missions. De plus, le partenaire doit assurer le suivi des prestations auxquelles il s'est engagé, contrôler leur bonne exécution et défendre activement les intérêts d'Agilitation si nécessaire.","[""Obligation générale de conseil. \na.Le Partenaire est tenu dans l’exécution de ses missions à une obligation générale de conseil et de respect de la réglementation en vigueur. \nb.Le Partenaire s’engage notamment à effectuer les prestations et/ou à remettre les livrables libre(s) de tous droits dans la limite des recherches pouvant être accomplies et de l’information qu’Agilitation lui aura communiqué. \nc.De manière générale le Partenaire rendra tous les services qu’une partie est raisonnablement en droit d'attendre s’agissant des prestations visées dans les Annexes (respect des règles de l’art par le Partenaire). \nd.Le Partenaire s’engage à fournir les moyens humains et matériels nécessaires à la bonne réalisation de ses missions et veille à assurer leur contrôle par des personnels expérimentés. \ne.Le Partenaire assure le suivi des prestations auxquelles il s’est engagé en contrôlant leur bonne exécution par les Partenaires sollicités et en formulant les réclamations éventuelles auprès des fournisseurs et en défendant activement les intérêts d’Agilitation pour obtenir satisfaction si nécessaire.""]",1.0,0.8757189000561939,0.16666666666666666
21,que veut dire LAD?,"LAD signifie ""lecture automatique de documents"". C'est un processus qui concerne la capture de données sur des documents structurés et non structurés. L'objectif n'est pas d'archiver des documents, mais d'alimenter un système d'informations avec les données contenues dans les documents numérisés. La LAD peut, par exemple, accélérer le traitement des factures fournisseurs en permettant l'archivage et l'indexation automatique de l'image du document et la saisie automatisée des écritures comptables.","[""Ne pas confondre reconnaissance automatique de documents, ou RAD, ou de type de documents et lecture automatique de documents (LAD). \nEn effet, si la reconnaissance de caractères ou de formes et autres cases à cocher permet de distinguer un document d’un autre ainsi que certains mots contenus de manière à alimenter une base d’index destinée à une gestion électronique de documents, l’appellation LAD, pour lecture automatique de documents, concerne les processus évolués de capture de données sur des documents structurés et désormais aussi non structurés.\nL’objectif n’est pas d’archiver des documents, mais d’alimenter un système d’informations (souvent un système de GED) avec les données contenues dans les documents numérisés dans le cadre de processus de type industriel. La richesse d’une solution avancée de LAD réside dans sa capacité à fournir, en bout de chaîne de traitement, la totalité des informations attendues par le système d'informations lui-même.\n\nUn système de reconnaissance faciale est une application logicielle visant à reconnaître automatiquement une personne grâce à son visage. Il s'agit d'un sujet particulièrement étudié en vision par ordinateur, avec de très nombreuses publications et brevets, et des conférences spécialisées.\nLa reconnaissance de visage a de nombreuses applications en vidéosurveillance, sécurité, biométrie, photographie, médecine, robotique, indexation d'images et de vidéos, recherche d'images par le contenu, etc. Ces systèmes sont généralement utilisés à des fins de sécurité publique ou de protection de la vie privée ou de données privées ou d'entreprises, dont pour déverrouiller ordinateur/mobile/console, mais aussi en domotique. Le fonctionnement de ces systèmes se base sur une ou plusieurs caméras pour reconnaître l'utilisateur.\n\nLa LAD prend une importance croissante dans les processus de dématérialisation où elle apparaît comme un axe de productivité.\nLa LAD permet, par exemple, d’accélérer le traitement des factures fournisseurs :\narchivage et indexation automatique de l'image du document ;\n(pré)saisie automatisée des écritures comptables (montants HT, TTC...).\nLa saisie des factures et, de façon plus générale, des documents transactionnels tels que bons de livraison ou bons de commande permet de réaliser des progrès dans l’organisation en fiabilisant les procédures de traitement avec une alimentation plus rapide du système d’information.""]",1.0,0.9552221409443901,0.07142857142857142
22,Un gros avantage des solution de type LAD?,"Un gros avantage des solutions de type LAD (lecture automatique de documents) est leur capacité à fournir la totalité des informations attendues par le système d'informations. Elles permettent d'accélérer le traitement des factures fournisseurs grâce à l'archivage et l'indexation automatique de l'image du document et la saisie automatisée des écritures comptables. De plus, elles fiabilisent les procédures de traitement en alimentant plus rapidement le système d’information.","[""Ne pas confondre reconnaissance automatique de documents, ou RAD, ou de type de documents et lecture automatique de documents (LAD). \nEn effet, si la reconnaissance de caractères ou de formes et autres cases à cocher permet de distinguer un document d’un autre ainsi que certains mots contenus de manière à alimenter une base d’index destinée à une gestion électronique de documents, l’appellation LAD, pour lecture automatique de documents, concerne les processus évolués de capture de données sur des documents structurés et désormais aussi non structurés.\nL’objectif n’est pas d’archiver des documents, mais d’alimenter un système d’informations (souvent un système de GED) avec les données contenues dans les documents numérisés dans le cadre de processus de type industriel. La richesse d’une solution avancée de LAD réside dans sa capacité à fournir, en bout de chaîne de traitement, la totalité des informations attendues par le système d'informations lui-même.\n\nUn système de reconnaissance faciale est une application logicielle visant à reconnaître automatiquement une personne grâce à son visage. Il s'agit d'un sujet particulièrement étudié en vision par ordinateur, avec de très nombreuses publications et brevets, et des conférences spécialisées.\nLa reconnaissance de visage a de nombreuses applications en vidéosurveillance, sécurité, biométrie, photographie, médecine, robotique, indexation d'images et de vidéos, recherche d'images par le contenu, etc. Ces systèmes sont généralement utilisés à des fins de sécurité publique ou de protection de la vie privée ou de données privées ou d'entreprises, dont pour déverrouiller ordinateur/mobile/console, mais aussi en domotique. Le fonctionnement de ces systèmes se base sur une ou plusieurs caméras pour reconnaître l'utilisateur.\n\nLa LAD prend une importance croissante dans les processus de dématérialisation où elle apparaît comme un axe de productivité.\nLa LAD permet, par exemple, d’accélérer le traitement des factures fournisseurs :\narchivage et indexation automatique de l'image du document ;\n(pré)saisie automatisée des écritures comptables (montants HT, TTC...).\nLa saisie des factures et, de façon plus générale, des documents transactionnels tels que bons de livraison ou bons de commande permet de réaliser des progrès dans l’organisation en fiabilisant les procédures de traitement avec une alimentation plus rapide du système d’information.""]",1.0,0.9698993162995327,0.07142857142857142
23,A quel champ appartient la reconnaissance faciale?,La reconnaissance faciale appartient au champ de la vision par ordinateur.,"[""Ne pas confondre reconnaissance automatique de documents, ou RAD, ou de type de documents et lecture automatique de documents (LAD). \nEn effet, si la reconnaissance de caractères ou de formes et autres cases à cocher permet de distinguer un document d’un autre ainsi que certains mots contenus de manière à alimenter une base d’index destinée à une gestion électronique de documents, l’appellation LAD, pour lecture automatique de documents, concerne les processus évolués de capture de données sur des documents structurés et désormais aussi non structurés.\nL’objectif n’est pas d’archiver des documents, mais d’alimenter un système d’informations (souvent un système de GED) avec les données contenues dans les documents numérisés dans le cadre de processus de type industriel. La richesse d’une solution avancée de LAD réside dans sa capacité à fournir, en bout de chaîne de traitement, la totalité des informations attendues par le système d'informations lui-même.\n\nUn système de reconnaissance faciale est une application logicielle visant à reconnaître automatiquement une personne grâce à son visage. Il s'agit d'un sujet particulièrement étudié en vision par ordinateur, avec de très nombreuses publications et brevets, et des conférences spécialisées.\nLa reconnaissance de visage a de nombreuses applications en vidéosurveillance, sécurité, biométrie, photographie, médecine, robotique, indexation d'images et de vidéos, recherche d'images par le contenu, etc. Ces systèmes sont généralement utilisés à des fins de sécurité publique ou de protection de la vie privée ou de données privées ou d'entreprises, dont pour déverrouiller ordinateur/mobile/console, mais aussi en domotique. Le fonctionnement de ces systèmes se base sur une ou plusieurs caméras pour reconnaître l'utilisateur.\n\nLa LAD prend une importance croissante dans les processus de dématérialisation où elle apparaît comme un axe de productivité.\nLa LAD permet, par exemple, d’accélérer le traitement des factures fournisseurs :\narchivage et indexation automatique de l'image du document ;\n(pré)saisie automatisée des écritures comptables (montants HT, TTC...).\nLa saisie des factures et, de façon plus générale, des documents transactionnels tels que bons de livraison ou bons de commande permet de réaliser des progrès dans l’organisation en fiabilisant les procédures de traitement avec une alimentation plus rapide du système d’information.""]",1.0,0.9732512777865815,0.0
24,Parles moi de l'angoument médiatique et scientifique de la vision par ordinateur,"La vision par ordinateur est un domaine qui a suscité un grand intérêt médiatique et scientifique. Elle englobe plusieurs technologies, dont la reconnaissance automatique de documents (RAD) et la lecture automatique de documents (LAD), ainsi que la reconnaissance faciale.

La RAD est utilisée pour distinguer un document d'un autre en reconnaissant des caractères, des formes et d'autres éléments. Elle alimente une base d'index pour la gestion électronique de documents. La LAD, en revanche, concerne les processus avancés de capture de données sur des documents structurés et non structurés. Son objectif n'est pas d'archiver des documents, mais d'alimenter un système d'informations avec les données contenues dans les documents numérisés. La LAD est de plus en plus importante dans les processus de dématérialisation, où elle est considérée comme un axe de productivité. Elle permet d'accélérer le traitement des factures fournisseurs, par exemple, en automatisant l'archivage, l'indexation et la saisie des écritures comptables.

La reconnaissance faciale est une autre application de la vision par ordinateur qui a reçu beaucoup d'attention. Elle est utilisée pour reconnaître automatiquement une personne grâce à son visage. Cette technologie a de nombreuses applications, notamment en vidéosurveillance, sécurité, biométrie, photographie, médecine, robotique, indexation d'images et de vidéos, recherche d'images par le contenu, etc. Les systèmes de reconnaissance faciale sont généralement utilisés à des fins de sécurité publique ou de protection de la vie privée ou de données privées ou d'entreprises.

En somme, la vision par ordinateur est un domaine en pleine expansion qui offre de nombreuses possibilités d'application. Son développement est soutenu par un grand nombre de publications et de brevets, ainsi que par des conférences spécialisées.","[""Ne pas confondre reconnaissance automatique de documents, ou RAD, ou de type de documents et lecture automatique de documents (LAD). \nEn effet, si la reconnaissance de caractères ou de formes et autres cases à cocher permet de distinguer un document d’un autre ainsi que certains mots contenus de manière à alimenter une base d’index destinée à une gestion électronique de documents, l’appellation LAD, pour lecture automatique de documents, concerne les processus évolués de capture de données sur des documents structurés et désormais aussi non structurés.\nL’objectif n’est pas d’archiver des documents, mais d’alimenter un système d’informations (souvent un système de GED) avec les données contenues dans les documents numérisés dans le cadre de processus de type industriel. La richesse d’une solution avancée de LAD réside dans sa capacité à fournir, en bout de chaîne de traitement, la totalité des informations attendues par le système d'informations lui-même.\n\nUn système de reconnaissance faciale est une application logicielle visant à reconnaître automatiquement une personne grâce à son visage. Il s'agit d'un sujet particulièrement étudié en vision par ordinateur, avec de très nombreuses publications et brevets, et des conférences spécialisées.\nLa reconnaissance de visage a de nombreuses applications en vidéosurveillance, sécurité, biométrie, photographie, médecine, robotique, indexation d'images et de vidéos, recherche d'images par le contenu, etc. Ces systèmes sont généralement utilisés à des fins de sécurité publique ou de protection de la vie privée ou de données privées ou d'entreprises, dont pour déverrouiller ordinateur/mobile/console, mais aussi en domotique. Le fonctionnement de ces systèmes se base sur une ou plusieurs caméras pour reconnaître l'utilisateur.\n\nLa LAD prend une importance croissante dans les processus de dématérialisation où elle apparaît comme un axe de productivité.\nLa LAD permet, par exemple, d’accélérer le traitement des factures fournisseurs :\narchivage et indexation automatique de l'image du document ;\n(pré)saisie automatisée des écritures comptables (montants HT, TTC...).\nLa saisie des factures et, de façon plus générale, des documents transactionnels tels que bons de livraison ou bons de commande permet de réaliser des progrès dans l’organisation en fiabilisant les procédures de traitement avec une alimentation plus rapide du système d’information.""]",0.8888888888888888,0.8553037550546033,0.2857142857142857
25,Application concrètes de la vision par ordinateur,"La vision par ordinateur a de nombreuses applications concrètes dans divers domaines. 

1. Reconnaissance et Lecture Automatique de Documents (RAD et LAD) : Ces processus utilisent la vision par ordinateur pour distinguer différents types de documents, reconnaître des caractères ou des formes, et capturer des données à partir de documents structurés et non structurés. Ces données sont ensuite utilisées pour alimenter un système d'information, souvent dans le cadre d'un processus industriel. Par exemple, la LAD peut accélérer le traitement des factures fournisseurs en permettant l'archivage et l'indexation automatique de l'image du document, ainsi que la saisie automatisée des écritures comptables.

2. Reconnaissance Faciale : C'est une application logicielle qui utilise la vision par ordinateur pour reconnaître automatiquement une personne grâce à son visage. Elle a de nombreuses applications en vidéosurveillance, sécurité, biométrie, photographie, médecine, robotique, indexation d'images et de vidéos, recherche d'images par le contenu, etc. Ces systèmes sont généralement utilisés à des fins de sécurité publique ou de protection de la vie privée ou de données privées ou d'entreprises.

3. Dématérialisation : La vision par ordinateur joue un rôle important dans les processus de dématérialisation, où elle permet d'accélérer et de fiabiliser le traitement des documents transactionnels tels que les bons de livraison ou les bons de commande. 

En somme, la vision par ordinateur est un outil précieux pour l'automatisation des processus, l'amélioration de la sécurité et l'augmentation de la productivité.","[""Ne pas confondre reconnaissance automatique de documents, ou RAD, ou de type de documents et lecture automatique de documents (LAD). \nEn effet, si la reconnaissance de caractères ou de formes et autres cases à cocher permet de distinguer un document d’un autre ainsi que certains mots contenus de manière à alimenter une base d’index destinée à une gestion électronique de documents, l’appellation LAD, pour lecture automatique de documents, concerne les processus évolués de capture de données sur des documents structurés et désormais aussi non structurés.\nL’objectif n’est pas d’archiver des documents, mais d’alimenter un système d’informations (souvent un système de GED) avec les données contenues dans les documents numérisés dans le cadre de processus de type industriel. La richesse d’une solution avancée de LAD réside dans sa capacité à fournir, en bout de chaîne de traitement, la totalité des informations attendues par le système d'informations lui-même.\n\nUn système de reconnaissance faciale est une application logicielle visant à reconnaître automatiquement une personne grâce à son visage. Il s'agit d'un sujet particulièrement étudié en vision par ordinateur, avec de très nombreuses publications et brevets, et des conférences spécialisées.\nLa reconnaissance de visage a de nombreuses applications en vidéosurveillance, sécurité, biométrie, photographie, médecine, robotique, indexation d'images et de vidéos, recherche d'images par le contenu, etc. Ces systèmes sont généralement utilisés à des fins de sécurité publique ou de protection de la vie privée ou de données privées ou d'entreprises, dont pour déverrouiller ordinateur/mobile/console, mais aussi en domotique. Le fonctionnement de ces systèmes se base sur une ou plusieurs caméras pour reconnaître l'utilisateur.\n\nLa LAD prend une importance croissante dans les processus de dématérialisation où elle apparaît comme un axe de productivité.\nLa LAD permet, par exemple, d’accélérer le traitement des factures fournisseurs :\narchivage et indexation automatique de l'image du document ;\n(pré)saisie automatisée des écritures comptables (montants HT, TTC...).\nLa saisie des factures et, de façon plus générale, des documents transactionnels tels que bons de livraison ou bons de commande permet de réaliser des progrès dans l’organisation en fiabilisant les procédures de traitement avec une alimentation plus rapide du système d’information.""]",1.0,0.9416528821947995,0.42857142857142855
26,Dans quel processus la LAD fait elle son essor?,"La LAD, ou lecture automatique de documents, fait son essor dans les processus de dématérialisation. Elle est particulièrement utile pour accélérer le traitement des factures fournisseurs, l'archivage et l'indexation automatique de documents, ainsi que la saisie automatisée des écritures comptables. De manière plus générale, elle permet de réaliser des progrès dans l'organisation en fiabilisant les procédures de traitement avec une alimentation plus rapide du système d'information.","[""Ne pas confondre reconnaissance automatique de documents, ou RAD, ou de type de documents et lecture automatique de documents (LAD). \nEn effet, si la reconnaissance de caractères ou de formes et autres cases à cocher permet de distinguer un document d’un autre ainsi que certains mots contenus de manière à alimenter une base d’index destinée à une gestion électronique de documents, l’appellation LAD, pour lecture automatique de documents, concerne les processus évolués de capture de données sur des documents structurés et désormais aussi non structurés.\nL’objectif n’est pas d’archiver des documents, mais d’alimenter un système d’informations (souvent un système de GED) avec les données contenues dans les documents numérisés dans le cadre de processus de type industriel. La richesse d’une solution avancée de LAD réside dans sa capacité à fournir, en bout de chaîne de traitement, la totalité des informations attendues par le système d'informations lui-même.\n\nUn système de reconnaissance faciale est une application logicielle visant à reconnaître automatiquement une personne grâce à son visage. Il s'agit d'un sujet particulièrement étudié en vision par ordinateur, avec de très nombreuses publications et brevets, et des conférences spécialisées.\nLa reconnaissance de visage a de nombreuses applications en vidéosurveillance, sécurité, biométrie, photographie, médecine, robotique, indexation d'images et de vidéos, recherche d'images par le contenu, etc. Ces systèmes sont généralement utilisés à des fins de sécurité publique ou de protection de la vie privée ou de données privées ou d'entreprises, dont pour déverrouiller ordinateur/mobile/console, mais aussi en domotique. Le fonctionnement de ces systèmes se base sur une ou plusieurs caméras pour reconnaître l'utilisateur.\n\nLa LAD prend une importance croissante dans les processus de dématérialisation où elle apparaît comme un axe de productivité.\nLa LAD permet, par exemple, d’accélérer le traitement des factures fournisseurs :\narchivage et indexation automatique de l'image du document ;\n(pré)saisie automatisée des écritures comptables (montants HT, TTC...).\nLa saisie des factures et, de façon plus générale, des documents transactionnels tels que bons de livraison ou bons de commande permet de réaliser des progrès dans l’organisation en fiabilisant les procédures de traitement avec une alimentation plus rapide du système d’information.""]",1.0,0.8795242262047512,0.07142857142857142
27,Quelles sont les applications de la LAD?,"Les applications de la Lecture Automatique de Documents (LAD) sont nombreuses et variées. Elle est notamment utilisée dans les processus de dématérialisation pour accélérer le traitement des factures fournisseurs grâce à l'archivage et l'indexation automatique de l'image du document et la saisie automatisée des écritures comptables. De manière plus générale, la LAD est utilisée pour la saisie de documents transactionnels tels que les bons de livraison ou les bons de commande, ce qui permet de réaliser des progrès dans l'organisation en fiabilisant les procédures de traitement avec une alimentation plus rapide du système d'information.","[""Ne pas confondre reconnaissance automatique de documents, ou RAD, ou de type de documents et lecture automatique de documents (LAD). \nEn effet, si la reconnaissance de caractères ou de formes et autres cases à cocher permet de distinguer un document d’un autre ainsi que certains mots contenus de manière à alimenter une base d’index destinée à une gestion électronique de documents, l’appellation LAD, pour lecture automatique de documents, concerne les processus évolués de capture de données sur des documents structurés et désormais aussi non structurés.\nL’objectif n’est pas d’archiver des documents, mais d’alimenter un système d’informations (souvent un système de GED) avec les données contenues dans les documents numérisés dans le cadre de processus de type industriel. La richesse d’une solution avancée de LAD réside dans sa capacité à fournir, en bout de chaîne de traitement, la totalité des informations attendues par le système d'informations lui-même.\n\nUn système de reconnaissance faciale est une application logicielle visant à reconnaître automatiquement une personne grâce à son visage. Il s'agit d'un sujet particulièrement étudié en vision par ordinateur, avec de très nombreuses publications et brevets, et des conférences spécialisées.\nLa reconnaissance de visage a de nombreuses applications en vidéosurveillance, sécurité, biométrie, photographie, médecine, robotique, indexation d'images et de vidéos, recherche d'images par le contenu, etc. Ces systèmes sont généralement utilisés à des fins de sécurité publique ou de protection de la vie privée ou de données privées ou d'entreprises, dont pour déverrouiller ordinateur/mobile/console, mais aussi en domotique. Le fonctionnement de ces systèmes se base sur une ou plusieurs caméras pour reconnaître l'utilisateur.\n\nLa LAD prend une importance croissante dans les processus de dématérialisation où elle apparaît comme un axe de productivité.\nLa LAD permet, par exemple, d’accélérer le traitement des factures fournisseurs :\narchivage et indexation automatique de l'image du document ;\n(pré)saisie automatisée des écritures comptables (montants HT, TTC...).\nLa saisie des factures et, de façon plus générale, des documents transactionnels tels que bons de livraison ou bons de commande permet de réaliser des progrès dans l’organisation en fiabilisant les procédures de traitement avec une alimentation plus rapide du système d’information.""]",1.0,0.9286701170408195,0.07142857142857142
